{
  "contractVersion": "1.0",
  "messageType": "analysis-response",
  "jobId": "11111111-1111-4111-8111-111111111111",
  "completedUtc": "2026-07-26T12:00:01Z",
  "engine": {
    "id": "com.masseyslab.cleanupsuite.engine",
    "version": "0.1.0",
    "protocolVersion": "1.0"
  },
  "echo": {
    "snapshotId": "19bf158bd8df8689bde609794bedab21ca3785bd51773083f0233436ddeef6b6",
    "toolId": "punctuation-normalizer",
    "toolDefinitionVersion": "1.0.0"
  },
  "status": "completed",
  "candidates": [
    {
      "candidateId": "c000001",
      "state": "applicable",
      "reasonCode": "table.empty-row",
      "location": {
        "storyType": "main-text",
        "startUtf16": 0,
        "endUtf16": 8,
        "offsetBasis": "snapshot-relative-utf16-code-units"
      },
      "fingerprint": {
        "algorithm": "sha256-utf8-exact",
        "snapshotId": "19bf158bd8df8689bde609794bedab21ca3785bd51773083f0233436ddeef6b6",
        "exactTextSha256": "27d2d50619a7dc22ce31b063b97fdcc6ec2c08388e541f5a000568ef1b5a92f0",
        "prefixLengthUtf16": 0,
        "prefixSha256": "e3b0c44298fc1c149afbf4c8996fb92427ae41e4649b934ca495991b7852b855",
        "suffixLengthUtf16": 7,
        "suffixSha256": "34e8b60c7a5a2e13a0846636ffce5be445e9bb87d1b01a41978bad5d168ac4c0",
        "structureSha256": "cccccccccccccccccccccccccccccccccccccccccccccccccccccccccccccccc"
      },
      "operation": {
        "type": "removeTableRow",
        "safetyClass": "structural-destructive",
        "parameters": {
          "tableOrdinal": 1,
          "rowOrdinal": 1
        }
      },
      "revalidation": {
        "requireWholeScopeSnapshot": true,
        "requireExactRange": true,
        "requireContext": true,
        "requireStructure": true,
        "onMismatch": "abort-apply",
        "allowRelocation": false
      },
      "confidence": {
        "tier": "deterministic",
        "score": 1.0
      },
      "display": {
        "label": "Empty table row",
        "canHighlight": false
      }
    }
  ],
  "summary": {
    "total": 1,
    "applicable": 1,
    "reviewOnly": 0,
    "protected": 0,
    "skipped": 0
  },
  "diagnostics": {
    "durationMs": 9,
    "warningCodes": [],
    "logContainsDocumentContent": false
  }
}
